nl_rhasspy_721_1602006784|Oké, enorm gechargeerd.
nl_rhasspy_231_1602310709|Voor aanvullende informatie over de toegankelijkheid, zie onze website.
nl_rhasspy_1053_1601732460|Zo ook deze keer weer speciaal.
nl_rhasspy_370_1602255851|Er zit ook een tjiftjaf tussen, schaars deze dagen.
nl_rhasspy_742_1601902834|En ten tweede: waar willen wij met elkaar naar toe?
nl_rhasspy_584_1602083767|Dat eeuwig gevoel van liefde.
nl_rhasspy_731_1601902978|Fietsverhuur in de straat.
nl_rhasspy_140_1602335696|Tot ik dan dat vreemde kaasje zag liggen.
nl_rhasspy_521_1602169833|In welke staat is de accu?
nl_rhasspy_242_1602310505|Meld je snel aan voor een woensdag, zaterdag of zondag in november.
nl_rhasspy_1088_1601731858|Ah nu zie ik het!
nl_rhasspy_192_1602333885|De blaadjes hangen stil aan de bomen.
nl_rhasspy_965_1601818442|Je kunt er wijn en bier proeven, maar ook chocola en kaas.
nl_rhasspy_943_1601819008|Zet je strijkijzer op de stand 'wol'.
nl_rhasspy_441_1602171006|Ben je aan het gluren naar mama?
nl_rhasspy_19_1602427992|Af en toe lekker lui is gezond.
nl_rhasspy_719_1602006811|Dichtbij u in de buurt.
nl_rhasspy_604_1602083490|Dit zijn insuline en glucagon.
nl_rhasspy_1102_1601731589|En dan druk ik me nog vrij eufemistisch uit.
nl_rhasspy_1015_1601817582|Ga jij de uitdaging aan?
nl_rhasspy_832_1601891602|Als het ook nog geluid maakt zal het een grote aantrekkingskracht tot je baby hebben.
nl_rhasspy_1120_1601731228|Hoe lichter je bagage, des te meer je mee kunt nemen.
nl_rhasspy_1091_1601731801|U mag ze zelf vullen.
nl_rhasspy_662_1602007631|Thuis hebben ze geen computer, alleen op school kan hij een computer gebruiken.
nl_rhasspy_875_1601890963|U moet er zelf nog heet water bij doen en goed schudden.
nl_rhasspy_779_1601902326|U kunt hem gemakkelijk bereiken.
nl_rhasspy_702_1602007079|Hoe is dat voor je partner?
nl_rhasspy_970_1601818371|Wat vond je van de hoeveelheid tekst op deze pagina?
nl_rhasspy_1089_1601731837|Meer informatie over het huren van een fiets vind je op de pagina Fietsverhuur Amsterdam.
nl_rhasspy_1033_1601732848|Doe je mee? Procrastineren is niet moeilijk!
nl_rhasspy_533_1602084456|Ik hoop dat u mij kunt helpen.
nl_rhasspy_148_1602335509|Deze kleuren kunnen per meter worden aangepast via de configuratie.
nl_rhasspy_1160_1601730118|De tenen zijn niet mooi roze.
nl_rhasspy_750_1601902711|Met al onze reizen door Europa.
nl_rhasspy_153_1602335385|Gênant, dat kan ik je zeggen!
nl_rhasspy_17_1602428023|Dit kost u niets en verplicht u tot niets.
nl_rhasspy_498_1602170142|Ik heb dat ding één keer gedragen en er is niet veel meer van over.
nl_rhasspy_789_1601902182|Nee, zeker niet.
nl_rhasspy_467_1602170583|En dan moet een mens eerlijk nee antwoorden.
nl_rhasspy_892_1601890749|Schrijf dan op deze pagina een recensie!
nl_rhasspy_516_1602169927|Geen idee of ik het nog kan?
nl_rhasspy_77_1602427161|Bijzonder overnachten in een wijnvat.
nl_rhasspy_876_1601890948|Wist u dat u uw bestelling van deur tot deur kunt volgen?
nl_rhasspy_417_1602171322|Dat kan u ook overkomen.
nl_rhasspy_842_1601891456|Uw rijbewijs blijft dan geldig.
nl_rhasspy_408_1602255294|Ik zal naast u zitten.
nl_rhasspy_828_1601901604|Ik maak er gewoon zelf zo één!
nl_rhasspy_112_1602336075|Dat wordt zeer op prijs gesteld.
nl_rhasspy_665_1602007588|Maar nee het was geen collega.
nl_rhasspy_612_1602083337|Wat super goed is trouwens.
nl_rhasspy_190_1602333927|Mooi dat je deze hebt geschreven!
nl_rhasspy_392_1602255544|Europa heeft nieuwe verhalen nodig.
nl_rhasspy_670_1602007498|Nodig je familie uit!
nl_rhasspy_69_1602427279|Ben jij anders dan de rest?
nl_rhasspy_253_1602310321|Dat is nog steeds lager dan die van alle omringende staten.
nl_rhasspy_309_1602309287|Ik pas het met liefde opnieuw voor jullie aan.
nl_rhasspy_121_1602335949|Dit werk heeft hij eind jaren tachtig gemaakt.
nl_rhasspy_885_1601890830|De aanhouder wint!
nl_rhasspy_1061_1601732335|Vroeger wist ik nooit wanneer mijn hypo's kwamen.
nl_rhasspy_548_1602084270|Auto uit en naar binnen maar.
nl_rhasspy_32_1602427856|Of sluit deze melding.
nl_rhasspy_246_1602310443|Welk eten is goed voor mij en mijn kind?
nl_rhasspy_492_1602170201|Dit kan bewust of onbewust gebeuren.
nl_rhasspy_259_1602310208|Komt laten wij aanbidden, komt laten wij aanbidden.
nl_rhasspy_783_1601902268|Bestelling aanpassen of annuleren.
nl_rhasspy_22_1602427962|Je broer blijft je broer.
nl_rhasspy_947_1601818933|Daarbij wordt onder andere naar Europa gekeken.
nl_rhasspy_855_1601891255|Man, vrouw, oud of jong, iedereen is welkom.
nl_rhasspy_345_1602256165|Dat ziet er mooi uit.
nl_rhasspy_285_1602309793|De Dikke van Dam maakt er zelfs geen melding van.
nl_rhasspy_714_1602006891|Zoals tandpasta, ijs en soep.
nl_rhasspy_1019_1601817515|Giet af en laat afkoelen.
nl_rhasspy_173_1602334171|Ik heb liever dat je eerlijk bent over mij.
nl_rhasspy_857_1601891223|Ik voelde me zo oud en depressief, echt rot.
nl_rhasspy_323_1602256469|Je geeft ze bagage mee voor hun hele leven.
nl_rhasspy_378_1602255727|Voor je het weet, ben je oud.
nl_rhasspy_541_1602084370|Plan je vakantie in Friesland.
nl_rhasspy_904_1601890586|Wij zullen uw gegevens dan ook aan niemand doorgeven.
nl_rhasspy_449_1602170876|De rijkdom zit in ons hart.
nl_rhasspy_1027_1601817314|Wil je werken bij Blauw Amsterdam?
nl_rhasspy_136_1602335761|Ze is gepassioneerd door verhalen.
nl_rhasspy_388_1602255591|En toch leg ik mijn functie niet neer.
nl_rhasspy_207_1602333676|En Lou is gek op Bob.
nl_rhasspy_208_1602333664|Omdat wij veel via e-mail doen.
nl_rhasspy_84_1602427083|Dan zijn wij uw alternatief.
nl_rhasspy_92_1602426912|De schemering valt en bijna ook mijn oogleden.
nl_rhasspy_429_1602171152|Leven in het veen is niet gemakkelijk.
nl_rhasspy_798_1601902041|Doe maar gewoon en zo.
nl_rhasspy_220_1602310854|Dus eind goed, al goed.
nl_rhasspy_457_1602170725|Wie goed doet, goed ontmoet.
nl_rhasspy_204_1602333718|Gemiddeld is augustus de warmste maand.
nl_rhasspy_585_1602083753|De inhoud is bij voorkeur niet commercieel!
nl_rhasspy_811_1601901853|Uw jurk waait dan niet meer weg.
nl_rhasspy_326_1602256434|Nee, antwoord ik, ik wil alleen slapen.
nl_rhasspy_1110_1601731417|De dader is een man uit Bangladesh die al enkele jaren in Amerika woont.
nl_rhasspy_1001_1601817805|Ze zijn gewoon eetbaar.
nl_rhasspy_199_1602333788|Waarmee u dus niet vanaf nul hoeft te beginnen.
nl_rhasspy_1076_1601732082|Maar zo heb ik het geleerd.
nl_rhasspy_64_1602427364|Dat zijn wij eigenlijk altijd gebleven.
nl_rhasspy_638_1602008010|Plaats de andere kant van de mal er boven op.
nl_rhasspy_509_1602170017|Eind goed al goed dus.
nl_rhasspy_737_1601902894|Heb nog geen manier gevonden om in de douche ook alle haren weg te scheren.
nl_rhasspy_573_1602083939|om er een paar van onlangs te noemen.
nl_rhasspy_72_1602427248|Leuk hoor, die introductie eind juni.
nl_rhasspy_976_1601818233|Op maandag is de zaak gesloten.
nl_rhasspy_274_1602309973|Ja, één keer, en dan niet meer.
nl_rhasspy_418_1602171309|Zorgen over het milieu heeft hij niet.
nl_rhasspy_537_1602084412|Ik vind dat een mooi gebaar.
nl_rhasspy_5_1602428168|Bleek ze klein te zijn joh haha!
nl_rhasspy_628_1602008169|Scheelt dus niet zo veel, valt reuze mee.
nl_rhasspy_86_1602427061|Ze zou zich moeten schamen.
nl_rhasspy_317_1602256544|Kogelrond zullen ze niet worden.
nl_rhasspy_172_1602334193|Er wordt taugé van gemaakt.
nl_rhasspy_146_1602335539|Ik rouw er niet om.
nl_rhasspy_1077_1601732070|Maar is ie er ook in het echt?
nl_rhasspy_664_1602007602|De aard van het werk en de manier van aanpak werd helemaal anders.
nl_rhasspy_581_1602083804|Moe waren de dames zeker, dat is wel duidelijk.
nl_rhasspy_930_1601890150|De basis voor de overwinning werd in de eerste helft gelegd.
nl_rhasspy_1039_1601732744|Neem een ervaren gids mee op uw reis.
nl_rhasspy_1_1602428220|Een kat hoort immers te miauwen, en niet te praten.
nl_rhasspy_225_1602310792|Je bent gewoon te lui om te werken!
nl_rhasspy_984_1601818093|Beu om in het donker in en uit je auto te stappen?
nl_rhasspy_178_1602334112|Hé ik heb iets gevonden.
nl_rhasspy_903_1601890603|Bagage uit de auto.
nl_rhasspy_1092_1601731772|Deze zal een maand na afloop worden geïncasseerd.
nl_rhasspy_954_1601818624|Ik ben moe van broccoli.
nl_rhasspy_933_1601819154|Laat het brood buiten de oven op een rooster afkoelen.
nl_rhasspy_381_1602255696|Je zou er bijna over kijken.
nl_rhasspy_1123_1601731115|U kunt deze week van maandag tot en met zaterdag hier terecht.
nl_rhasspy_473_1602170490|Maar dat vonden ze geen argument.
nl_rhasspy_805_1601901942|Pas op met uw planning.
nl_rhasspy_57_1602427460|Tel daarbij de politie-uren.
nl_rhasspy_745_1601902789|Hoe gaat het met je?
nl_rhasspy_850_1601891342|Dit alles is in een handomdraai in te stellen voor iedere gebruiker.
nl_rhasspy_964_1601818459|Bijvoorbeeld in een kas of de garage.
nl_rhasspy_1142_1601730678|Slank en lang heeft geen gang, zei ze.
nl_rhasspy_1075_1601732094|Maar het is nu zo urgent.
nl_rhasspy_847_1601891388|Laat het ons weten als u op vakantie gaat.
nl_rhasspy_902_1601890618|Je bent echt zo in de stad, maar je woont echt buiten.
nl_rhasspy_841_1601891470|De regering heeft aangekondigd om met een plan van aanpak te komen.
nl_rhasspy_879_1601890909|Vragen of gewoon nieuwsgierig?
nl_rhasspy_520_1602169861|En dat was geen kleinigheid.
nl_rhasspy_1078_1601732053|Na overspel heb je een 'vreemde' in huis.
nl_rhasspy_154_1602334432|Speelt het milieu een rol?
nl_rhasspy_768_1601902447|Ik was al vele jaren het huis uit.
nl_rhasspy_913_1601890448|Dus ja eigenlijk wel.
nl_rhasspy_658_1602007700|Maar ja, dat is toch een beetje wij van WC Eend adviseren WC Eend.
nl_rhasspy_226_1602310780|En dit werkt verbluffend goed.
nl_rhasspy_174_1602334154|Al gauw ontmoet ze allerlei mensen die haar voor een jongen aanzien.
nl_rhasspy_642_1602007939|Dit is de aangifte van verhuizing.
nl_rhasspy_880_1601890896|Bij het hotel is er een fietsverhuur.
nl_rhasspy_810_1601901870|Heel bijzonder en wat hebben jullie een geduld moeten hebben (en nog steeds).
nl_rhasspy_1021_1601817477|Net na de kerstdagen viel er nog een kerstkaartje binnen.
nl_rhasspy_311_1602256617|Dat ze in hun geloof houvast vinden?
nl_rhasspy_682_1602007325|Ook ging hij uit van twintig mensen in plaats van tachtig.
nl_rhasspy_735_1601902925|Toch denk ik dat promotie heel lastig wordt.
nl_rhasspy_477_1602170420|Wist je dat de sauna dé Finse manier van ontspannen is?
nl_rhasspy_928_1601890181|Maar dat is meer dan loonkost alleen.
nl_rhasspy_212_1602310983|Dit staat in de Wet gebruik burgerservicenummer in de zorg.
nl_rhasspy_40_1602427730|Het plan ontmoet bijna unaniem kritiek.
nl_rhasspy_169_1602334256|Ze zien de bui al hangen.
nl_rhasspy_158_1602334383|Eindelijk die winterkleding uit.
nl_rhasspy_474_1602170463|Ik zie nu pas dat mensen nog vragen stellen over mijn casus.
nl_rhasspy_333_1602256339|Zeker lekker om mee onder de douche te nemen.
nl_rhasspy_517_1602169909|Wij verdiepen ons in uw situatie en adviseren u op maat.
nl_rhasspy_1159_1601730292|Hij kiest zelf uit wanneer en vooral voor wie.
nl_rhasspy_527_1602084538|Geen idee hoe ik dat moet doen.
nl_rhasspy_542_1602084359|Volgens mij moest je er om lachen.
nl_rhasspy_487_1602170234|Passend bij wie je bent.
nl_rhasspy_960_1601818520|En van jaloezie?
nl_rhasspy_622_1602083182|Denk niet te veel na over de verandering.
nl_rhasspy_630_1602008130|Nog nooit hebt u voor uw euro zo veel gekregen.
nl_rhasspy_355_1602256036|Laat ze in de vorm afkoelen.
nl_rhasspy_925_1601890224|Ze gaan weer op stap en nemen deel aan de samenleving.
nl_rhasspy_312_1602256592|We zaten schijnbaar net aan de rand van de bui.
nl_rhasspy_782_1601902282|Ik hoef ook geen leespauze om die verklaring te lezen.
nl_rhasspy_793_1601902128|Hoop snel weer terug te komen.
nl_rhasspy_466_1602170597|Dit kan dus geen verrassing zijn.
nl_rhasspy_936_1601819104|Kortom op zee blijven tot de wind af ging nemen.
nl_rhasspy_738_1601902877|Dat zou ik morgen even na moeten vragen.
nl_rhasspy_1051_1601732488|Daar haal je het aan, ja.
nl_rhasspy_102_1602426749|Schep de ui over in een kom en laat afkoelen.
nl_rhasspy_926_1601890211|En daar blijft het niet bij.
nl_rhasspy_553_1602084209|Voor een moeder is haar gezin alles.
nl_rhasspy_421_1602171259|Door zijn vorm is deze asbak zeer stabiel.
nl_rhasspy_282_1602309859|Bestel de maat die uw kind in zijn kleding heeft.
nl_rhasspy_111_1602336088|Laat de siroop wat afkoelen.
nl_rhasspy_217_1602310895|Het water loopt mij bijna uit mijn mond.
nl_rhasspy_44_1602427657|Goed programma dat goed op elkaar aansluit.
nl_rhasspy_1057_1601732405|Dit heet de menopauze of overgang.
nl_rhasspy_163_1602334318|Ik zal voor jullie Berceuse spelen.
nl_rhasspy_193_1602333874|Welke bestemming past bij wie?
nl_rhasspy_26_1602427931|Jij bent de baas, ik doe wat je zegt.
nl_rhasspy_599_1602083555|Waarom andere sloten en sleutels?
nl_rhasspy_778_1601902340|Het heeft me toen mijn leven terug gegeven.
nl_rhasspy_836_1601891543|Waarom dat is ga ik proberen uit te leggen.
nl_rhasspy_235_1602310644|Je moeder dus, niet die vrouw.
nl_rhasspy_1006_1601817740|Daar ligt de sleutel.
nl_rhasspy_826_1601901632|En dat je daar verhalen hoort over hoe het daar is.
nl_rhasspy_1162_1601730069|Nu weet ik hoe het ook kan.
nl_rhasspy_908_1601890517|Dit wordt dé plek.
nl_rhasspy_705_1602007040|Gemiddeld gaat het om vijfenvijftig euro per maand.
nl_rhasspy_755_1601902638|Is Hij wel de Koning?
nl_rhasspy_1063_1601732300|Eten doe ik ook al niet en heb ook gewoon geen honger.
nl_rhasspy_357_1602256005|Gemakkelijk te installeren en te configureren.
nl_rhasspy_255_1602310292|Zijn ze bewust doof voor wat er aan de basis leeft?
nl_rhasspy_206_1602333685|Nee, zegt de andere helft.
nl_rhasspy_130_1602335833|Zelfs de mens Jezus niet!
nl_rhasspy_213_1602310951|Waarom moet ik mij nu opnieuw aanmelden?
nl_rhasspy_468_1602170570|Waar leeft u eigenlijk voor?
nl_rhasspy_901_1601890633|Een boot het is eens wat anders.
nl_rhasspy_50_1602427575|Ik ga er zeker niet eten.
nl_rhasspy_726_1602006710|Het was vast pure jaloezie.
nl_rhasspy_314_1602256567|Meneer giraf is daar perfect voor.
nl_rhasspy_914_1601890435|Neem een handdoek of matje mee!
nl_rhasspy_736_1601902916|Nee, eigenlijk niet.
nl_rhasspy_147_1602335527|Nu beginnen de zenuwen pas echt te komen.
nl_rhasspy_625_1602083135|Meer controle zou voor de hand hebben gelegen.
nl_rhasspy_942_1601819019|Maar geen jas was perfect.
nl_rhasspy_503_1602170087|En ja hoor, dat werkt!
nl_rhasspy_9_1602428110|Mooi zoals je alles hebt gecombineerd.
nl_rhasspy_766_1601902480|In blauw en grijstinten.
nl_rhasspy_1072_1601732133|Wie o wie?
nl_rhasspy_961_1601818502|U kunt op deze pagina ook terecht voor het aanvraagformulier.
nl_rhasspy_171_1602334209|Waar zijn dan uw goden, die gij u gemaakt hebt?
nl_rhasspy_159_1602334371|Je hoeft niet zo nerveus te zijn, joh.
nl_rhasspy_1014_1601817597|Zo ja, bij wie en graag toelichten.
nl_rhasspy_395_1602255506|Dat is de aard van het vak.
nl_rhasspy_878_1601890921|Kostprijs: zes miljoen euro.
nl_rhasspy_660_1602007667|De fiets van betrokkene lag er nog.
nl_rhasspy_568_1602084024|Omdat het hoort bij de leeuw.
nl_rhasspy_518_1602169884|De ijsvogel kan zich daar nestelen.
nl_rhasspy_894_1601890731|Lees dan gauw verder!
nl_rhasspy_759_1601902579|Die moeten gewoon betalen en niet zeuren.
nl_rhasspy_128_1602335857|Niet meer kopen is goed voor het milieu en economie.
nl_rhasspy_1139_1601730720|Lees de twee verslagen hier.
nl_rhasspy_1032_1601732877|Was de taugé.
nl_rhasspy_700_1602007107|Wel zo eerlijk.
nl_rhasspy_781_1601902299|Het is voorzien van plexiglas, dus niet breekbaar.
nl_rhasspy_35_1602427819|Dat maakt zingen in een koor zo uniek.
nl_rhasspy_1163_1601730051|Maar er zou nog zo veel meer mogelijk moeten zijn.
nl_rhasspy_508_1602170027|Niet dat er geen controle op de macht hoeft te zijn.
nl_rhasspy_710_1602006953|En als ie dat doet, waarom zou hij dat dan bij een huis niet doen?
nl_rhasspy_465_1602170608|je moestuin ziet er geweldig uit!
nl_rhasspy_340_1602256222|Ik help u dit doel te bereiken.
nl_rhasspy_116_1602336026|Meestal zegt mijn geest dat ik moe ben.
nl_rhasspy_310_1602309269|Zijn humeur leed er niet onder.
nl_rhasspy_647_1602007869|De rest neemt dit idee ook over.
nl_rhasspy_30_1602427885|Ik zou de andere zeker niet enorm duur noemen.
nl_rhasspy_1023_1601817425|Ook het gebruik van een viool deed de band opvallen.
nl_rhasspy_983_1601818124|Bent u ook nieuwsgierig geworden?
nl_rhasspy_471_1602170532|Kunt u gemakkelijk vinden wat u zoekt?
nl_rhasspy_393_1602255533|En waarom zou het gebeuren?
nl_rhasspy_631_1602008118|De euro wordt minder waard.
nl_rhasspy_995_1601817902|Dit percentage is echter een gemiddelde.
nl_rhasspy_1003_1601817773|Vaak wordt brandschilderen gecombineerd met glas in lood.
nl_rhasspy_776_1601902361|Dit alles in het belang van de jeugdigen.
nl_rhasspy_325_1602256447|Laat het reizen aan uw gevoel over.
nl_rhasspy_428_1602171164|Uiteindelijk valt u in slaap.
nl_rhasspy_98_1602426833|Welk meisje wil deze fiets nu niet?
nl_rhasspy_1099_1601731633|Er staat nogal wat op het spel!
nl_rhasspy_78_1602427149|Maar je hebt zeker een punt.
nl_rhasspy_659_1602007682|Voor de laatste keer op de boot een douche nemen.
nl_rhasspy_21_1602427972|Hoe lang kun jij overleven?
nl_rhasspy_1030_1601817267|Van welk deel ben je dan nog niet helemaal tevreden?
nl_rhasspy_888_1601890799|Bye bye basisschool!
nl_rhasspy_399_1602255439|Nee hoor, niets van dat alles.
nl_rhasspy_691_1602007207|Ja, zo lang is dat al geleden.
nl_rhasspy_1147_1601730549|Wat zal hij lekker slapen.
nl_rhasspy_95_1602426878|Begin eraan en de rest zal volgen.
nl_rhasspy_264_1602310130|En ja, u bent er pas net.
nl_rhasspy_252_1602310339|Elk jaar kwamen er meer bij en elk jaar namen de lasten toe.
nl_rhasspy_821_1601901706|Wie zoekt gij?
nl_rhasspy_865_1601891117|Denk bijvoorbeeld aan moe zijn, geen zin hebben, het is slecht weer enzovoort.
nl_rhasspy_1167_1601729905|Kunnen kinderen de hemel naar de aarde brengen?
nl_rhasspy_739_1601902867|Ja, zeker hoor!
nl_rhasspy_358_1602255996|Dus ben jij aan zet.
nl_rhasspy_991_1601817956|Zo lang ik me kan herinneren, ging de camera altijd met opa mee op pad.
nl_rhasspy_935_1601819125|Het moet een verrassing zijn.
nl_rhasspy_322_1602256483|Bibliotheek van de Universiteit van Amsterdam.
nl_rhasspy_939_1601819061|Doe ook eens wat!
nl_rhasspy_1009_1601817686|Het leven van een student is niet eenvoudig.
nl_rhasspy_829_1601891650|Dit meetinstrument is snel en eenvoudig in gebruik.
nl_rhasspy_635_1602008054|Dat komt door de vervuiling.
nl_rhasspy_39_1602427744|Die is dan eigenlijk baas onder de baas.
nl_rhasspy_649_1602007846|En zo is de cirkel rond.
nl_rhasspy_624_1602083149|De volgende keer zijn ze te oud.
nl_rhasspy_576_1602083897|En waarom mag niet elk Europees land meedoen?
nl_rhasspy_775_1601902378|Aanpassen van de naam heeft dus geen effect op de werking van het formulier.
nl_rhasspy_266_1602310101|Een mooi eiland om over te wandelen.
nl_rhasspy_276_1602309947|Dat mag je jezelf kwalijk nemen.
nl_rhasspy_1153_1601730427|Vanaf morgen hebt u ze in huis.
nl_rhasspy_633_1602008074|Dat komt door de zandgrond.
nl_rhasspy_1048_1601732559|Ga ook zelf op zoek.
nl_rhasspy_867_1601891091|Nee, ook niet omdat je dan beter vindbaar bent.
nl_rhasspy_139_1602335710|Carpoolen is goed voor het milieu, je portemonnee en de gezelligheid.
nl_rhasspy_248_1602310413|Het blad is langwerpig van vorm en is getand.
nl_rhasspy_339_1602256264|Joke is inmiddels dan bij ons komen zitten.
nl_rhasspy_596_1602083603|Ze vinden ze erg gaaf en handig.
nl_rhasspy_1000_1601817815|Al voelde ik mezelf niet zo oud.
nl_rhasspy_877_1601890935|Hoe moet dat gezin aan de kost komen?
nl_rhasspy_16_1602428035|Je kan niet naar het spreekuur komen.
nl_rhasspy_73_1602427234|Daarbij is er ruimte en tijd voor gesprek.
nl_rhasspy_1065_1601732261|Op de ene kant staat een vraag of aanwijzing, op de andere kant het antwoord.
nl_rhasspy_977_1601818216|Maakt het uit als hij er toch nooit komt?
nl_rhasspy_303_1602309500|Is dat niet een lief gebaar?
nl_rhasspy_31_1602427866|Onze eigen geest alleen kan dit soort kennis niet kennen.
nl_rhasspy_794_1601902112|Met deze presentatie ga je veel vogels leren kennen.
nl_rhasspy_637_1602008026|De golven en branding kwamen steeds dichterbij.
nl_rhasspy_366_1602255913|Wij hebben hier geen invloed op.
nl_rhasspy_469_1602170557|Maar de uitslag komt er snel aan!
nl_rhasspy_595_1602083615|Je zou er in kunnen verdwalen.
nl_rhasspy_896_1601890702|En daar was niets mis mee.
nl_rhasspy_792_1601902138|Met kerstmuziek dus.
nl_rhasspy_861_1601891171|Steeds in overleg met u.
nl_rhasspy_377_1602255737|Moet ik mij grote zorgen maken?
nl_rhasspy_889_1601890788|En wat een toffe vrouw is Roos.
nl_rhasspy_389_1602255581|Hoe hoog is de vergoeding?
nl_rhasspy_1105_1601731523|Even wachten tot het droog weer is, want de speurtocht is buiten.
nl_rhasspy_1119_1601731259|Wie is de koning van de Anglicaanse kerk?
nl_rhasspy_652_1602007795|Hoe komt lucht in je longen?
nl_rhasspy_191_1602333912|Dat had in hoofdzaak twee oorzaken.
nl_rhasspy_55_1602427496|Maar ik denk inderdaad niet dat dat Hebreeuws zal zijn.
nl_rhasspy_615_1602083292|Bijna tien jaar waren er in Algiers geen aanslagen.
nl_rhasspy_113_1602336061|Vind jij jezelf te dik of vind jij jezelf te dun?
nl_rhasspy_367_1602255892|Dat zou pas tien jaar later gebeuren.
nl_rhasspy_275_1602309961|De tekst zou antisemitisch zijn.
nl_rhasspy_751_1601902697|Of u nog wat wil geven voor de fanfare.
nl_rhasspy_334_1602256326|We doen de poort dicht.
nl_rhasspy_424_1602171219|Hierin fruit je de ui op een niet te hoog vuur.
nl_rhasspy_90_1602426940|En dus niet per se uit dat kookboek!
nl_rhasspy_1148_1601730536|Niet ieder bedrijf is sociaal.
nl_rhasspy_71_1602427260|Maar wat doet Europa eigenlijk?
nl_rhasspy_351_1602256096|Maar hoe eerlijk is die vergelijking?
nl_rhasspy_261_1602310177|Voor iedere aannemer is de behoefte anders.
nl_rhasspy_453_1602170813|Weet jij hoe je dit slim aanpakt?
nl_rhasspy_800_1601902010|Een opdracht wordt pas aanvaard nadat een offerte is uitgebracht.
nl_rhasspy_216_1602310913|De zoon heeft een andere voorkeur dan mama.
nl_rhasspy_1087_1601731894|Wie o wie kan mij helpen met mijn spierpijn?
nl_rhasspy_76_1602427172|We zijn actief in de randstad.
nl_rhasspy_447_1602170907|Niet omdat het geen mooi boek is.
nl_rhasspy_364_1602255926|Die uitslag staat al vast.
nl_rhasspy_165_1602334306|Zijn ze lekker moe als ze naar bed moeten.
nl_rhasspy_114_1602336050|Doen ze het niet uit luiheid?
nl_rhasspy_125_1602335899|De geschiedenis van uw bedrijf is de ziel van uw bedrijf.
nl_rhasspy_343_1602256198|De eerste plek vindt die ijdeltuit prachtig.
nl_rhasspy_975_1601818245|Wie weet zullen wij het in Nederland ook nog wel krijgen!
nl_rhasspy_338_1602256281|Je kunt theoretisch gezien in iedere auto lesgeven.
nl_rhasspy_304_1602309485|Nee uitslapen zat er zeker niet in.
nl_rhasspy_263_1602310142|Denkt u eraan uw eigendom te verkopen?
nl_rhasspy_450_1602170854|Hoi Romy, ten eerste gefeliciteerd met je moeder!
nl_rhasspy_904_1601890573|Wij zullen uw gegevens dan ook aan niemand doorgeven.
nl_rhasspy_68_1602427306|Ik maakte mijn melding en moest vervolgens mijn naam en adres opgeven.
nl_rhasspy_483_1602170282|Dat bleek enorm goed te gaan.
nl_rhasspy_256_1602310262|Je ziet ineens een kassa opengaan.
nl_rhasspy_643_1602007925|Meld je niet op het laatste nippertje af.
nl_rhasspy_1029_1601817284|Hoe sta je er sowieso op dit moment in?
nl_rhasspy_350_1602256108|Op te halen vanaf eind deze maand en begin volgende maand.
nl_rhasspy_412_1602255227|Hoe kwam hij ooit van de reu af?
nl_rhasspy_536_1602084422|Ik wist dat mijn vader het niet zou overleven.
nl_rhasspy_1090_1601731824|Doe vooral aangifte!
nl_rhasspy_1168_1601729885|Gooi oud brood niet weg.
nl_rhasspy_856_1601891239|Andere dagen eet je chips, drink je bier en lig je lui op de bank.
nl_rhasspy_846_1601891403|Men kan ieder soort geschenk geven, zoals geld of voedsel.
nl_rhasspy_437_1602171039|Ik heb een akelig gevoel.
nl_rhasspy_480_1602170361|Dan is deze job wat je zoekt.
nl_rhasspy_284_1602309822|Dat zou fantastisch zijn toch?
nl_rhasspy_1137_1601730749|Dan ziet Jan de fles te staan en wijst deze aan.
nl_rhasspy_270_1602310041|Sla dan nu uw slag!
nl_rhasspy_1047_1601732574|Dat heeft Jezus helemaal niet geleerd.
nl_rhasspy_870_1601891054|Wie het weet, mag het zeggen!
nl_rhasspy_748_1601902745|Ja, zo lust ik nog wel een.
nl_rhasspy_678_1602007378|Evenwichtig ruimte en richting geven.
nl_rhasspy_534_1602084446|Zou het dan vandaag lukken?
nl_rhasspy_681_1602007343|Je speelt nu het spel Royal Rush.
nl_rhasspy_985_1601818068|Luieren aan dek en erg veel gezien.
nl_rhasspy_268_1602310078|U hebt nu het eeuwig leven.
nl_rhasspy_819_1601901723|U moet uw administratie aanpassen.
nl_rhasspy_906_1601890545|Voor de inhoud van uw jas zijn wij niet aansprakelijk.
nl_rhasspy_979_1601818182|Smeuïg is 'ie zeker!
nl_rhasspy_425_1602171207|Het is niet alleen van de patiënt.
nl_rhasspy_918_1601890370|Vaak telt dat wie het eerste is, het gelijk automatisch op zijn hand heeft.
nl_rhasspy_60_1602427398|En goed voor het milieu ook!
nl_rhasspy_945_1601818976|Echt, waarom deze kerel de sleutels van Nederland nog niet gekregen heeft?
nl_rhasspy_513_1602169961|Het is dé tijd van gezelligheid en lekker eten.
nl_rhasspy_6_1602428155|Dit mag u niet missen!
nl_rhasspy_575_1602083910|Is er een theoretisch examen?
nl_rhasspy_157_1602334395|Heeft een van beiden een hartaandoening of last van astma?
nl_rhasspy_1149_1601730513|Wat vliegt de tijd toch.
nl_rhasspy_10_1602428099|Na enkele uren was ik goed moe.
nl_rhasspy_349_1602256123|Genezing is dan niet meer mogelijk.
nl_rhasspy_262_1602310162|Wees eens eerlijk: tof is die hè?
nl_rhasspy_1136_1601730766|Waar is die dokter als je hem nodig hebt?
nl_rhasspy_133_1602335797|In dit gesprek bespreken wij uw wensen.
nl_rhasspy_1124_1601731100|Het was zo mooi, zo prachtig.
nl_rhasspy_1054_1601732445|Adem in, adem uit.
nl_rhasspy_544_1602084318|Dan lees je op deze pagina hoe dat moet.
nl_rhasspy_1096_1601731698|Of ja, eigenlijk alles wel, haha!
