nl_rhasspy_470_1602170544|Het zou eigenlijk niet nodig moeten zijn.
nl_rhasspy_18_1602428011|Rietje erin en genieten maar.
nl_rhasspy_539_1602084392|Een aanwinst voor uw zaak!
nl_rhasspy_379_1602255716|Sluit Jezus niet op in de hemel!
nl_rhasspy_505_1602170053|Ga dan voor een vakantiebaan in Ede!
nl_rhasspy_460_1602170666|Waar zit nu die etiquette?
nl_rhasspy_690_1602007219|Ik doe eigenlijk van alles in de winkel.
nl_rhasspy_295_1602309635|En dat voor een schijntje.
nl_rhasspy_582_1602083788|Hoe wij dit bereiken, leest u op deze pagina.
nl_rhasspy_175_1602334138|Ik was bijvoorbeeld moe aan het einde van de dag.
nl_rhasspy_656_1602007733|Heus ik kijk echt uit om iedereen terug te zien.
nl_rhasspy_900_1601890645|Niet eens moe ging ik naar huis.
nl_rhasspy_324_1602256458|Zorgen dat jij lekker in je vel zit.
nl_rhasspy_528_1602084524|Oud worden moet tenslotte wel leuk zijn.
nl_rhasspy_293_1602309671|Daar was ze te zenuwachtig voor.
nl_rhasspy_238_1602310578|Ik had er voor de eerste pauze geen last van.
nl_rhasspy_609_1602083378|Dat u uw mening laat horen.
nl_rhasspy_215_1602310927|Daar zijn ze nog lang niet van mij af.
nl_rhasspy_843_1601891442|Neem contact op voor meer informatie over de mouterij!
nl_rhasspy_570_1602083988|Van scheuren in de wand valt iets leren.
nl_rhasspy_694_1602007180|Geen zin om mee uit te gaan.
nl_rhasspy_893_1601890739|Welkom in Italië.
nl_rhasspy_1042_1601732693|Hier wordt van alles verkocht.
nl_rhasspy_1150_1601730469|Ideaal voor wie eens zonder kinderen op vakantie wil.
nl_rhasspy_663_1602007618|Ze zijn niet uw eigendom.
nl_rhasspy_131_1602335819|Ik geloof dat ik eindelijk in de overgang ben.
nl_rhasspy_552_1602084224|Bijna met mijn mama op vakantie.
nl_rhasspy_485_1602170260|Dan komt de figuur in beweging.
nl_rhasspy_288_1602309753|En dat doen ze nogal gretig.
nl_rhasspy_957_1601818583|En wat is dan zo urgent dat aanscherping nodig is?
nl_rhasspy_405_1602255343|Daar hebben ze Europa niet voor nodig.
nl_rhasspy_397_1602255463|Dan mis je net de golf.
nl_rhasspy_337_1602256295|Ze zijn niet echt schuw.
nl_rhasspy_804_1601901954|Loop maar eens in een flink tempo vijf keer de trap op en af.
nl_rhasspy_831_1601891621|Na-apen is ook leuk.
nl_rhasspy_987_1601818027|Jong, oud, man of vrouw, iedereen is welkom.
nl_rhasspy_955_1601818610|Maar ik denk dat je wel een zakje voor de soep kunt gebruiken hoor.
nl_rhasspy_352_1602256083|Je hebt van die mensen die eeuwig jong blijven.
nl_rhasspy_538_1602084402|Focus daar je verhaal op.
nl_rhasspy_559_1602084134|Maar nu zijn we best wel moe eigenlijk.
nl_rhasspy_845_1601891419|Alleen God kan dat doen.
nl_rhasspy_51_1602427562|Ben jij per direct beschikbaar?
nl_rhasspy_716_1602006863|Eenvoudig zelf te maken, je moet alleen wat geduld hebben.
nl_rhasspy_586_1602083740|Je hebt nog mazzel gehad met dat treinverkeer.
nl_rhasspy_1011_1601817654|Toch wil je niet te veel andere mensen na-apen.
nl_rhasspy_886_1601890817|Dat doet de gemiddelde Duitse herder hem niet na!
nl_rhasspy_387_1602255603|Je kan aangifte doen bij politie of parket.
nl_rhasspy_430_1602171142|En dan nu uw vragen.
nl_rhasspy_802_1601901984|Is het vrijdag, zaterdag of zondag?
nl_rhasspy_299_1602309547|Eigenlijk had ik meer verwacht van dit boek.
nl_rhasspy_294_1602309657|Je bent hier primair verantwoordelijk voor.
nl_rhasspy_1115_1601731333|Wij gaan graag het gesprek met je aan.
nl_rhasspy_530_1602084478|Meer weten over dit initiatief?
nl_rhasspy_58_1602427445|Erg veel muziek en karaoke tot's morgens vroeg.
nl_rhasspy_1041_1601732709|Die kan verdwijnen, maar als het niet goed leeg is, vult het zich opnieuw.
nl_rhasspy_561_1602084100|De abdij staat te koop.
nl_rhasspy_331_1602256366|Ideaal voor mama en kind.
nl_rhasspy_1085_1601731918|Heel handig en representatief als u als bedrijf dat kan aantonen.
nl_rhasspy_141_1602335603|Ik ben Roos en negen jaar.
nl_rhasspy_396_1602255485|Lokaal ontstaat een licht buitje.
nl_rhasspy_210_1602333635|Er komt een tsunami van data over ons heen.
nl_rhasspy_455_1602170780|Voor altviool en piano of orgel. Niet voor bugel.
nl_rhasspy_866_1601891104|Zo ja, wat kan ik er tegen doen?
nl_rhasspy_834_1601891580|Oeps, twaalf jaar?
nl_rhasspy_636_1602008042|Ziet er wel heel erg grappig uit.
nl_rhasspy_951_1601818664|Kies op welke manier en hoe snel!
nl_rhasspy_723_1602006755|Of ken jij collega’s die hier actief mee bezig zijn?
nl_rhasspy_28_1602427899|Je kunt ook erg moe zijn, ja zelfs afgepeigerd.
nl_rhasspy_478_1602170391|Hij valt dus mooi over een tweepersoonsbed.
nl_rhasspy_872_1601891023|Ik mag ook al mee lekker wandelen naar het park en langs de rivier.
nl_rhasspy_1118_1601731274|Basisschool de Duif, daar kom je verder mee!
nl_rhasspy_683_1602007313|Deze kerk is verbluffend.
nl_rhasspy_462_1602170644|Neem de hele ui weg.
nl_rhasspy_177_1602334123|Dan zit je op deze pagina helemaal goed!
nl_rhasspy_97_1602426846|Ieder seizoen heeft zijn eigen schoonheid en geeft de streek haar eigen aanblik.
nl_rhasspy_510_1602170004|Iedere situatie en ieder kind is uniek.
nl_rhasspy_1022_1601817442|Leuk om te zien hoe men leeft.
nl_rhasspy_997_1601817875|Kunt u iets niet vinden of heeft u vragen?
nl_rhasspy_946_1601818954|Vereenvoudiging is een normaal proces voor talen.
nl_rhasspy_922_1601890278|Knus en gezellig in de loungeset.
nl_rhasspy_1045_1601732625|Nu wist echter de hele buurt het.
nl_rhasspy_589_1602083702|Kies dan voor een hoger abonnement.
nl_rhasspy_967_1601818413|U vindt bij ons wat u zoekt.
nl_rhasspy_708_1602006979|Sufheid kan optreden.
nl_rhasspy_757_1601902617|Mooi duurzaam meubilair is niet lelijk!
nl_rhasspy_407_1602255309|Geef eerlijk antwoord op deze vragen.
nl_rhasspy_715_1602006878|Aanpassen is een must.
nl_rhasspy_994_1601817915|Religie speelt geen grote rol in zijn leven.
nl_rhasspy_529_1602084495|Degene die dat doet, hoef ik er niet op aan te spreken omdat die man niet aanspreekbaar is.
nl_rhasspy_924_1601890240|Sluit de USB-kabel goed aan.
nl_rhasspy_825_1601901648|Er is nog een andere reden om over de voetgangersbrug te gaan.
nl_rhasspy_1117_1601731289|Wat is de overgang eigenlijk?
nl_rhasspy_1151_1601730455|Ja, vind je het gek dat je honger hebt?
nl_rhasspy_1132_1601730874|Hij maakt vrienden en is sociaal.
nl_rhasspy_129_1602335843|Je lichaam heeft zuurstof nodig.
nl_rhasspy_944_1601818993|Het is een thee die ik de hele dag door zou kunnen drinken.
nl_rhasspy_697_1602007140|We moeten van data eigenlijk direct informatie maken.
nl_rhasspy_93_1602426903|Dan kunnen wij je helpen.
nl_rhasspy_941_1601819030|En tijd voor mij.
nl_rhasspy_240_1602310553|Dan buig ik me over je heen.
nl_rhasspy_14_1602428062|En hoe oud kan een goudvis worden?
nl_rhasspy_565_1602084063|Ik denk na over eten.
nl_rhasspy_184_1602334021|Ik heb me altijd geuit zoals ik ben.
nl_rhasspy_3_1602428193|Ik hoop dat mijn pagina u helpt!
nl_rhasspy_916_1601890407|Ik was immers nog nooit in Zweden.
nl_rhasspy_308_1602309314|Laat jij iets van je horen wanneer je in Maastricht bent?
nl_rhasspy_717_1602006846|Altijd leuk om te lezen hoe het met jullie gaat.
nl_rhasspy_1131_1601730902|Dan zit je op de goede pagina!
nl_rhasspy_686_1602007277|Ik eet graag chocola.
nl_rhasspy_150_1602335482|Daar lieten wij erg veel steken vallen.
nl_rhasspy_1086_1601731908|Tot dit seizoen.
nl_rhasspy_1108_1601731481|Vandaag stond de speurtocht op het programma.
nl_rhasspy_1008_1601817713|Zorg dat je huis er netjes bij staat.
nl_rhasspy_1037_1601732773|Het is vrij eenvoudig om te spelen.
nl_rhasspy_484_1602170271|Je hebt daar veel steun aan.
nl_rhasspy_359_1602255985|Oei oei oei, mooi plan.
nl_rhasspy_1028_1601817298|Iedereen zit binnen en jij loopt door die regen.
nl_rhasspy_384_1602255653|Je kunt onder de vloer, die ligt open.
nl_rhasspy_1127_1601730988|Nee, we dachten van niet.
nl_rhasspy_514_1602169949|De oerknal zullen we daar echter niet vinden.
nl_rhasspy_431_1602171130|Je kan twee antwoorden aankruisen.
nl_rhasspy_101_1602426792|De tekst van de verklaring moet dan worden aangepast.
nl_rhasspy_840_1601891488|Zodra ik meer heb dan laat ik je dat weten.
nl_rhasspy_281_1602309875|Nee, je kunt niets kopiëren.
nl_rhasspy_774_1601902396|Niet zo janken.
nl_rhasspy_1035_1601732822|Hij schreef de toespraak voor De Geus.
nl_rhasspy_729_1601902998|Het kan moeilijk zijn om daar mee om te gaan.
nl_rhasspy_988_1601818015|Ze zijn daar heel handig mee!
nl_rhasspy_887_1601890808|Nu jullie nog.
nl_rhasspy_627_1602083120|Bestel hier uw papieren abonnement.
nl_rhasspy_873_1601890988|Dat kwam in het programma goed tot uiting.
nl_rhasspy_329_1602256394|Voor mij de job van mijn leven.
nl_rhasspy_152_1602335435|Zou best kunnen, denk ik.
nl_rhasspy_202_1602333743|Specialist in creëren en renoveren.
nl_rhasspy_427_1602171176|Een sauna en fietsverhuur zijn beschikbaar.
nl_rhasspy_911_1601890477|Het spelbord wordt open gelegd.
nl_rhasspy_688_1602007256|Terwijl men zes euro rekent.
nl_rhasspy_120_1602335976|De eerste keer hardlopen kan ik mij nog goed herinneren.
nl_rhasspy_743_1601902817|Wij kunnen dan altijd je bestelling aanpassen of annuleren.
nl_rhasspy_958_1601818565|Om met de deur in huis te vallen: nee, eigenlijk kan dat niet.
nl_rhasspy_1114_1601731346|Niet veel minder dan in het dorp Ede zelf.
nl_rhasspy_53_1602427528|Ook binnen een gezin doet elk kind dat op zijn eigen manier.
nl_rhasspy_566_1602084053|Het was zijn eigen schuld.
nl_rhasspy_616_1602083275|Een rijkdom, die zoals alle rijkdom relatief is.
nl_rhasspy_265_1602310114|De mensen van wie de oren gewassen worden.
nl_rhasspy_145_1602335549|Kwalitatief netjes, afwerking netjes, geen kritiek hier.
nl_rhasspy_37_1602427785|De Afsluitdijk is bijna klaar.
nl_rhasspy_921_1601890295|Bij betaling worden deze stilzwijgend aanvaard.
nl_rhasspy_117_1602336015|Laat Bo niet in de kou staan.
nl_rhasspy_785_1601902242|Dank voor de goede organisatie.
nl_rhasspy_346_1602256155|Groeten aan u en uw familie!
nl_rhasspy_122_1602335935|De loonkost in België ligt hoog!
nl_rhasspy_1060_1601732349|Kinderen en jeugdigen.
nl_rhasspy_170_1602334231|Wat vind jij van deze ringetjes?
nl_rhasspy_703_1602007071|Doe je mee?
nl_rhasspy_699_1602007115|Of gewoon bestel nu.
nl_rhasspy_833_1601891589|Hoe absurd kan het zijn.
nl_rhasspy_406_1602255324|Immers, de liefde zou leuk en spannend zijn!
nl_rhasspy_1129_1601730960|Mijn kind is zo anders dan ik toen ik zo oud was.
nl_rhasspy_1158_1601730328|Ja, en niet een paar ook!
nl_rhasspy_666_1602007575|Wij werken hem graag voor u uit.
nl_rhasspy_254_1602310308|Moet uw dak vervangen worden?
nl_rhasspy_205_1602333707|Dat is eigenlijk dubbel op.
nl_rhasspy_909_1601890504|In Zuid-Amerika is altijd wat te doen!
nl_rhasspy_137_1602335748|Bijvoorbeeld van toen ze nog een tienermeisje was.
nl_rhasspy_859_1601891200|Mijn vader is zeer op haar gesteld.
nl_rhasspy_13_1602428076|Dan komt dat veen aan de rand van de geul bloot.
nl_rhasspy_1128_1601730977|Waarom kun je?
nl_rhasspy_722_1602006769|Dit helpt het vaartuig uiteindelijk vooruit.
nl_rhasspy_241_1602310524|Ik zie er moe uit.
nl_rhasspy_555_1602084186|Nee, u kunt direct beginnen!
nl_rhasspy_373_1602255789|Ik kan hier nog uren over doorgaan.
nl_rhasspy_907_1601890526|Gaat u voor een wandelvakantie?
nl_rhasspy_2_1602428205|In andere straten is deze naam niet te vinden.
nl_rhasspy_236_1602310629|Want ik weet dat Roger veel verhalen heeft.
nl_rhasspy_1004_1601817762|En dan nog een zeer klein katje.
nl_rhasspy_605_1602083479|Ik leg het u uit.
nl_rhasspy_610_1602083364|Je doet het goed en bent sterk en moedig.
nl_rhasspy_989_1601817985|Hij geeft me opnieuw het zakje aan.
nl_rhasspy_547_1602084282|Af en toe eet je iets omdat je het lekker vindt.
nl_rhasspy_279_1602309897|Tegelijk werd de naam van de club aangepast.
nl_rhasspy_143_1602335575|Het is een weekdag vandaag.
nl_rhasspy_4_1602428183|Nee joh, die van mij niet.
nl_rhasspy_75_1602427184|Je kan dan een idee uit je buurt steunen.
nl_rhasspy_382_1602255683|Dus ja, eigenlijk al best lang.
nl_rhasspy_320_1602256514|De vele aaitjes vond ze prachtig.
nl_rhasspy_361_1602255974|Maar dan moet die data er wel zijn.
nl_rhasspy_823_1601901679|We hopen dat ze nog lang bij onze fanfare muziek blijven maken.
nl_rhasspy_862_1601891158|Mijn geheugen laat me een beetje in de steek, geloof ik.
nl_rhasspy_1073_1601732122|Dé plek om een tweedehands boot te verkopen.
nl_rhasspy_621_1602083205|In de brief staat hoe u dat kunt doen.
nl_rhasspy_1144_1601730641|U kunt de verzekering in één keer afsluiten voor het hele gezin.
nl_rhasspy_835_1601891568|De zelfgemaakte soep was geweldig.
nl_rhasspy_1154_1601730403|Gij zegt het: ik heb U lief Heer!
nl_rhasspy_1046_1601732615|Wie oren heeft, die hore!
nl_rhasspy_712_1602006926|Ze huren nu een aanleunwoning.
nl_rhasspy_698_1602007125|Evenmin verdwijnen zij automatisch.
nl_rhasspy_899_1601890658|Eindhoven zal wezen, Eindhoven zal zijn!
nl_rhasspy_416_1602171331|Kunt u uw auto eigenlijk niet missen?
nl_rhasspy_786_1601902221|Hij is een ware specialist.
nl_rhasspy_993_1601817929|Niet te lang stilstaan, het is koud.
nl_rhasspy_641_1602007950|Zo eerlijk bent u wel.
nl_rhasspy_948_1601818705|Echt een heel mooi moment met een heel leuk verhaal!
nl_rhasspy_574_1602083922|Laat uw licht dus schijnen in mijn duisternis.
nl_rhasspy_1130_1601730931|Ook zonder over te hevelen vindt er een nagisting plaats.
nl_rhasspy_247_1602310428|Aan deze pagina wordt nog gewerkt.
nl_rhasspy_1074_1601732107|Gebruik van een neologisme.
nl_rhasspy_401_1602255402|Wij wachten op uw antwoord!
nl_rhasspy_837_1601891531|De stad is al zo oud.
nl_rhasspy_1165_1601729988|Goed laten afkoelen.
nl_rhasspy_179_1602334096|Mensen die er komen om zich religieus te laten vermaken.
nl_rhasspy_830_1601891633|Tim is niet moe, maar heeft het ook wel gehad.
nl_rhasspy_749_1601902725|Zij helpen u graag met al uw vragen, zodat u snel verder kunt.
nl_rhasspy_300_1602309536|Je bent te moe of te druk.
nl_rhasspy_486_1602170245|Of je nu jong, oud, dik of dun bent.
nl_rhasspy_88_1602426962|Kortom een woning uniek in zijn soort.
nl_rhasspy_1106_1601731512|Ik was moe.
nl_rhasspy_87_1602427039|Er is reuring en schwung nodig.
nl_rhasspy_413_1602255208|Zolang Focus leeft kan het immers altijd beter.'
nl_rhasspy_115_1602336039|Grappig man, in het Deens.
nl_rhasspy_43_1602427690|Hij weet zeker dat de Ierse republiek neutraal is.
nl_rhasspy_1031_1601732888|Wat kun je jezelf toch in de maling nemen.
nl_rhasspy_336_1602256306|Dan is de giraf iets voor u.
nl_rhasspy_34_1602427834|En nu is er een eerste pagina, een begin.
nl_rhasspy_218_1602310877|Ede is partner binnen dit project.
nl_rhasspy_33_1602427848|Waarom zou je het doen?
nl_rhasspy_105_1602426666|De dame van de bar vroeg vijf euro.
nl_rhasspy_771_1601902419|En maak jij ook wel eens muesli?
nl_rhasspy_452_1602170827|In dit scherm kunt u meteen de beoordeling aangeven.
nl_rhasspy_822_1601901696|Zo heeft uw kind het nooit te koud.
nl_rhasspy_12_1602428090|Dat zou ik niet zoeken.
nl_rhasspy_812_1601901818|Om uit te vinden en opnieuw uit te vinden.
nl_rhasspy_905_1601890559|Waarom woon je in een boom en niet in een wolkenkrabber?
nl_rhasspy_269_1602310053|Jezus is gekwetst en laat dat zien.
nl_rhasspy_302_1602309513|Het is gemakkelijk te bereiken.
nl_rhasspy_290_1602309725|Dat je er slecht van zou gaan zien?
nl_rhasspy_1066_1601732245|Die nacht sliep Jezus niet.
nl_rhasspy_677_1602007391|Een likdoorn op uw tenen?
nl_rhasspy_897_1601890684|Mijn voorkeur gaat absoluut uit naar een dame die wel een gesprek kan voeren.
nl_rhasspy_1152_1601730440|Maar je bent te lui om over te stappen.
nl_rhasspy_1161_1601730094|Een feest voor wie iets te vieren heeft.
nl_rhasspy_598_1602083570|Na een klein half uur zit je dan al in de bossen.
nl_rhasspy_96_1602426867|En ben jij ook nog eens fit?
nl_rhasspy_1135_1601730782|Lekker als tussendoortje, maar ook handig om mee te nemen naar je werk!
nl_rhasspy_680_1602007356|Wauw één jaar!
nl_rhasspy_91_1602426925|Dan komt de melding uiteindelijk bij de politie terecht.
nl_rhasspy_671_1602007485|Het is waar u behoefte aan hebt.
nl_rhasspy_952_1601818652|U weet meteen waar u aan toe bent.
nl_rhasspy_1113_1601731361|Dit heet 'in verzekering stellen'.
nl_rhasspy_982_1601818136|Wat is een boom eigenlijk?
nl_rhasspy_807_1601901917|Creatief om zo met het team bezig te zijn.
nl_rhasspy_651_1602007808|Het gaat er niet om wat een verkoper zelf bijzonder vindt aan de woning.
nl_rhasspy_328_1602256411|Mag ik je e-mail hebben?
nl_rhasspy_20_1602427982|Conciërge moet een saaie baan zijn.
nl_rhasspy_291_1602309701|Advent is de tijd van kerstliedjes.
nl_rhasspy_817_1601901753|Ah daar ben je dan.
nl_rhasspy_149_1602335495|Hoe ontstaat pijn tijdens de bevalling?
nl_rhasspy_59_1602427423|Zorg voor koffie, thee en iets lekkers dat je kan oppeuzelen.
nl_rhasspy_546_1602084295|Een verhaaltje over de kinderen.
nl_rhasspy_940_1601819045|Ze zeuren zo vaak, en de laatste tijd maken we er zelfs ruzie over.
nl_rhasspy_182_1602334049|De voering is gemaakt van textiel.
nl_rhasspy_720_1602006798|De koffie staat altijd voor u klaar.
nl_rhasspy_571_1602083966|Je leest er meer over in dit artikel.
nl_rhasspy_777_1601902352|Ik heb een schuld.
nl_rhasspy_1169_1601729868|Voor hen is het seminar echter niet verplicht.
nl_rhasspy_1044_1601732651|Verder goed hotel: mooi zwembad en vriendelijk.
nl_rhasspy_267_1602310089|Zie Ierland, Griekenland en Portugal.
nl_rhasspy_363_1602255949|Zoek de vrouw uit de hoofdstad van Afghanistan.
nl_rhasspy_481_1602170324|Geen ruzie met de lampjes en alleen rode kerstversiering.
nl_rhasspy_978_1601818194|Altijd een moe gevoel?
nl_rhasspy_1098_1601731662|Deze zijn immers gericht op het verzamelen van controle en macht.
nl_rhasspy_648_1602007858|Maar dan wou hij wel informatie hebben.
nl_rhasspy_187_1602333964|Dit is op loopafstand van Station Alkmaar.
nl_rhasspy_108_1602336125|Er komt geen nieuwe functionaliteit beschikbaar.
nl_rhasspy_62_1602427387|Wie ben jij en waar sta jij voor?
nl_rhasspy_67_1602427335|Dat zijn mensen in beweging, jij zit op dat moment in stilte.
nl_rhasspy_81_1602427122|Ik vind je buik prachtig!
nl_rhasspy_495_1602170180|En kocht u een andere klapstoel?
nl_rhasspy_1005_1601817748|Niet super, best aardig.
nl_rhasspy_368_1602255878|De kleuren kunnen wij u tonen in de winkel.
nl_rhasspy_371_1602255836|Je kunt niet alles onder controle hebben.
nl_rhasspy_769_1601902438|Bent u wat later?
nl_rhasspy_562_1602084086|Zorg ervoor dat uw auto u niet in de kou laat staan!
nl_rhasspy_383_1602255672|Bij gemeenten werkt dat anders.
nl_rhasspy_629_1602008150|Hoe kan je dat gezicht zien zonder mededogen en zelfs liefde te voelen?
nl_rhasspy_260_1602310192|Het geeft een aangenaam gevoel van gladheid.
nl_rhasspy_602_1602083516|Je mag komen zoals je bent.
nl_rhasspy_249_1602310399|Welk wapen is daar tegen bestand?
nl_rhasspy_42_1602427704|Nu bent u aan zet.
nl_rhasspy_1056_1601732418|Inderdaad, buiten de woonkern.
nl_rhasspy_106_1602426653|Hierin zijn wij dé specialist.
nl_rhasspy_882_1601890866|Hoe bijzonder wil je het hebben?
nl_rhasspy_162_1602334330|Hoe erg zal die zijn?
nl_rhasspy_556_1602084173|Wij willen dat mama altijd bij ons is.
nl_rhasspy_504_1602170078|Maar weet je niet meer van wie?
nl_rhasspy_597_1602083586|Dat zou uniek zijn in de geschiedenis van de Senaat.
nl_rhasspy_1134_1601730844|Een verbluffend lekker glas!
nl_rhasspy_797_1601902055|Dan hebben wij dé plek voor je!
nl_rhasspy_63_1602427376|Hallo eerste week van september!
nl_rhasspy_707_1602007009|Schitterend zo op het dak van Noorwegen te staan!
nl_rhasspy_258_1602310225|Vuurwerk kan bij dieren voor veel spanning zorgen.
nl_rhasspy_999_1601817827|Wie o wie kan ons helpen?
nl_rhasspy_791_1601902149|Als het goed gaat, maak je een mooi rendement.
nl_rhasspy_414_1602255147|Hebben die lui er nog zin in?
nl_rhasspy_1059_1601732360|Pas als alles geautomatiseerd in bestelling is gezet moet u aan het werk.
nl_rhasspy_1155_1601730375|Eigendom mag van de commissie.
nl_rhasspy_142_1602335587|Moet ik me nu echt slecht voelen?
nl_rhasspy_618_1602083237|De verf laat zich gemakkelijk verwerken.
nl_rhasspy_446_1602170919|En dan nog de vraag waarom.
nl_rhasspy_1083_1601731954|Commercieel gebruik van deze gegevens is niet toegestaan.
nl_rhasspy_1010_1601817669|Wie o wie gaat er winnen, en welke weg gaan ze nemen?
nl_rhasspy_362_1602255963|Het zou een concept kunnen zijn.
nl_rhasspy_244_1602310470|Daar kun jij je bijdrage aan leveren!
nl_rhasspy_1094_1601731746|Ga toch fietsen.
nl_rhasspy_990_1601817973|Ik was eigenlijk te jong om mee te doen.
nl_rhasspy_684_1602007299|Ga eens buikdansen om in je lichaam te komen.
nl_rhasspy_839_1601891502|Zoekend naar troost. Wie troost mij?
nl_rhasspy_442_1602170991|Zijn dat er nu echt zo veel?
nl_rhasspy_787_1601902201|Ben je moe of heb je honger?
nl_rhasspy_1002_1601817789|De hond is ook welkom. We hebben ervaring met asielhonden.
nl_rhasspy_8_1602428130|Deze vinden plaats na zeven uur.
nl_rhasspy_728_1602006685|Ik wil dat ze gewoon na elkaar gebeuren.
nl_rhasspy_790_1601902169|Zie trouwens de pagina 'Waar zijn we nu?'
nl_rhasspy_45_1602427628|Haal ze van me af, haal ze van me af!
nl_rhasspy_221_1602310841|Hoe alles geworden is, is echt fantastisch!
nl_rhasspy_747_1601902761|Sluit nauw aan.
nl_rhasspy_968_1601818398|Als dit op uw nieuwe aanslag staat hoeft u verder niets te doen.
nl_rhasspy_229_1602310734|Ze kunnen niet voor u eten.
nl_rhasspy_237_1602310606|Hele foute verhalen over jezelf gesignaleerd?
nl_rhasspy_657_1602007721|Als je toch bezig bent?
nl_rhasspy_209_1602333650|En ik ben ook journaliste.
nl_rhasspy_335_1602256316|De Muur hielp niet in Berlijn.
nl_rhasspy_848_1601891378|Maar het is wel erg mooi!
nl_rhasspy_283_1602309835|Dit keer was die afgesloten.
nl_rhasspy_1104_1601731545|Meer nog het is een misdaad tegen het leven.
nl_rhasspy_123_1602335923|Ieder draagt zijn eigen bagage.
nl_rhasspy_278_1602309912|Elk eigendom zijn uniek verhaal.
